{
  "asset": "BTC-USDT",
  "venues": [
    "binance",
    "okx",
    "bybit",
    "coinbase",
    "kraken"
  ],
  "market_types": [
    "spot_usdt"
  ],
  "timeframes": [
    "15m"
  ],
  "outputs": {
    "raw_scan_by_timeframe": [
      "raw_scan_15m.json"
    ],
    "composite_ohlcv_by_timeframe": [
      "composite_ohlcv_15m.json"
    ],
    "composite_orderbook_ladder_by_timeframe": [
      "composite_orderbook_ladder_15m.json"
    ],
    "combined_composite_ohlcv": "composite_ohlcv.json",
    "combined_composite_orderbook_ladder": "composite_orderbook_ladder.json",
    "data_quality": "data_quality.json"
  },
  "data_quality_by_timeframe": {
    "15m": {
      "asset": "BTC-USDT",
      "venues_requested": [
        "binance",
        "okx",
        "bybit",
        "coinbase",
        "kraken"
      ],
      "venues_ok": [
        "binance",
        "bybit",
        "coinbase",
        "kraken",
        "okx"
      ],
      "venues_failed": [],
      "market_types": [
        "spot_usdt"
      ],
      "timeframe": "15m",
      "missing_sources": [],
      "overall_quality": 0.8488643761301989,
      "status": "OK"
    }
  },
  "limitations": [
    "Public exchange endpoints only; no private orderflow.",
    "Composite orderbook ladder is a public snapshot bucket proxy, not a consolidated matching-engine book.",
    "No trading signal, execution instruction, or profitability claim is generated."
  ]
}